<?xml version="1.0" encoding="UTF-8"?>
<!DOCTYPE days SYSTEM "timetable.dtd">
<!--
Set 4G schedule by day
-->

<days>
    <day type="Monday">
        <class>
            <name>Computer Graphics</name>
            <code>COMP4560</code>
            <instructor1>Brenda Fine</instructor1>
            <time>8:30 - 10:20</time>
            <location>SE12-320</location>
            <type>Lab</type>
        </class>
        <class>
            <name>Operating Systems</name>
            <code>COMP4735</code>
            <instructor1>Mirela Gutica</instructor1>
            <time>11:30 - 12:20</time>
            <location>SW1-1205</location>
            <type>Lecture</type>
        </class>
        <class>
            <name>Operating Systems</name>
            <code>COMP4735</code>
            <instructor1>Mathew Linder</instructor1>
            <time>3:30 - 5:20</time>
            <location>SW3-1710</location>
            <type>Lab</type>
        </class>
    </day>

    <day type="Tuesday">
        <class>
            <name>Computer Graphics</name>
            <code>COMP4560</code>
            <instructor1>Brenda Fine</instructor1>
            <time>11:30 - 12:20</time>
            <location>SW5-1850</location>
            <type>Lecture</type>
        </class>
        <class>
            <name>Software Development</name>
            <code>COMP4711</code>
            <instructor1>James Parry</instructor1>
            <time>12:30 - 2:20</time>
            <location>SE12-320</location>
            <type>Lab</type>
        </class>
        <class>
            <name>Software Development</name>
            <code>COMP4711</code>
            <instructor1>James Parry</instructor1>
            <time>12:30 - 2:20</time>
            <location>SW5-1840</location>
            <type>Lecture</type>
        </class>
    </day>

    <day type="Wednesday">
        <class>
            <name>Client Server Special Topics</name>
            <code>COMP4945</code>
            <instructor1>Tejinder Randhawa</instructor1>
            <time>9:30 - 10:20</time>
            <location>SE12-319</location>
            <type>Lecture</type>
        </class>
        <class>
            <name>Client Server 2</name>
            <code>COMP4941</code>
            <instructor1>Tejinder Randhawa</instructor1>
            <time>10:30 - 11:20</time>
            <location>SE12-319</location>
            <type>Lab</type>
        </class>
        <class>
            <name>Operating Systems</name>
            <code>COMP4735</code>
            <instructor1>Mirela Gutica</instructor1>
            <time>1:30 - 2:20</time>
            <location>SW1-1205</location>
            <type>Lecture</type>
        </class>
    </day>

    <day type="Thursday">
        <class>
            <name>Business Law</name>
            <code>BLAW3600</code>
            <instructor1>Catherine Ryan</instructor1>
            <time>9:30 - 11:20</time>
            <location>SW3-2620</location>
            <type>Lab</type>
        </class>
        <class>
            <name>Operating Systems</name>
            <code>COMP4735</code>
            <instructor1>Mirela Gutica</instructor1>
            <time>11:30 - 12:20</time>
            <location>SW3-1710</location>
            <type>Lecture</type>
        </class>
        <class>
            <name>Client Server Special Topics</name>
            <code>COMP4945</code>
            <instructor1>Tejinder Randhawa</instructor1>
            <time>1:30 - 5:20</time>
            <location>SE12-319</location>
            <type>Lab</type>
        </class>
    </day>

    <day type="Friday">
        <class>
            <name>Business Law</name>
            <code>BLAW3600</code>
            <instructor1>Catherine Ryan</instructor1>
            <time>8:30 - 10:20</time>
            <location>SW5-1840</location>
            <type>Lecture</type>
        </class>
        <class>
            <name>Computer Graphics</name>
            <code>COMP4560</code>
            <instructor1>Brenda Fine</instructor1>
            <time>12:30 - 1:20</time>
            <location>SW3-1750</location>
            <type>Lecture</type>
        </class>
        <class>
            <name>Client Server 2</name>
            <code>COMP4941</code>
            <instructor1>Tejinder Randhawa</instructor1>
            <time>1:30 - 5:20</time>
            <location>SE12-319</location>
            <type>Lab</type>
        </class>
    </day>
</days>

